<?xml version="1.0" ?>
<!-- $Header: $  -->
<!-- Made-up  light atten XML file for EM, according to calCalib_v2-new.dtd -->

<!DOCTYPE calCalib SYSTEM "../calCalib_v2r1.dtd" [] >

<calCalib>
  <generic instrument="EM" timestamp="2003-11-2-12:56"
           calibType="CAL_LightAsym" fmtVersion="v2r0">

    <inputSample startTime="2003-2-21-05:49:12" stopTime="2003-2-24-07:07:02"
		triggers="random" mode="normal" source="stuff" >

		Times are start and stop time of calibration run.
		Other attributes are just made up for code testing.
    </inputSample>
  </generic>


  <!-- EM instrument: 8 layers, 12 columns -->

  <dimension nRow="1" nCol="1" nLayer="8" nXtal="12" nFace="1" nRange="2"/>

  <tower iRow="0" iCol="0">
    <layer iLayer="0">
      <xtal iXtal="0">
	<face end="NA">
          <lightAsym diode="LE"
               values="0.1 1.2 2.3 3.4 4.5 5.6 6.7 7.8 8.9 9.0"
               error="0.1" />
          <lightAsym diode="HE"
               values="0.1 1.2 2.3 3.4 4.5 5.6 6.7 7.8 8.9 9.0"
               error="0.1" />
        </face>
      </xtal>
      <xtal iXtal="1">
        <face end="NA">
          <lightAsym diode="LE"
               values="0.1 1.2 2.3 3.4 4.5 5.6 6.7 7.8 8.9 9.0"
               error="0.1" />
          <lightAsym diode="HE"
               values="0.1 1.2 2.3 3.4 4.5 5.6 6.7 7.8 8.9 9.0"
               error="0.1" />

        </face>
      </xtal>
      <xtal iXtal="2">
        <face end="NA">
          <lightAsym diode="LE"
               values="0.1 1.2 2.3 3.4 4.5 5.6 6.7 7.8 8.9 9.0"
               error="0.1" />
          <lightAsym diode="HE"
               values="0.1 1.2 2.3 3.4 4.5 5.6 6.7 7.8 8.9 9.0"
               error="0.1" />
        </face>
      </xtal>
      <xtal iXtal="3">
        <face end="NA">
          <lightAsym diode="LE"
               values="0.1 1.2 2.3 3.4 4.5 5.6 6.7 7.8 8.9 9.0"
               error="0.1" />
          <lightAsym diode="HE"
               values="0.1 1.2 2.3 3.4 4.5 5.6 6.7 7.8 8.9 9.0"
               error="0.1" />
        </face>
      </xtal>
      <xtal iXtal="4">
        <face end="NA">
          <lightAsym diode="LE"
               values="0.1 1.2 2.3 3.4 4.5 5.6 6.7 7.8 8.9 9.0"
               error="0.1" />
          <lightAsym diode="HE"
               values="0.1 1.2 2.3 3.4 4.5 5.6 6.7 7.8 8.9 9.0"
               error="0.1" />
        </face>
      </xtal>
      <xtal iXtal="5">
        <face end="NA">
          <lightAsym diode="LE"
               values="0.1 1.2 2.3 3.4 4.5 5.6 6.7 7.8 8.9 9.0"
               error="0.1" />
          <lightAsym diode="HE"
               values="0.1 1.2 2.3 3.4 4.5 5.6 6.7 7.8 8.9 9.0"
               error="0.1" />
        </face>
      </xtal>
      <xtal iXtal="6">
        <face end="NA">
          <lightAsym diode="LE"
               values="0.1 1.2 2.3 3.4 4.5 5.6 6.7 7.8 8.9 9.0"
               error="0.1" />
          <lightAsym diode="HE"
               values="0.1 1.2 2.3 3.4 4.5 5.6 6.7 7.8 8.9 9.0"
               error="0.1" />
        </face>
      </xtal>
      <xtal iXtal="7">
        <face end="NA">
          <lightAsym diode="LE"
               values="0.1 1.2 2.3 3.4 4.5 5.6 6.7 7.8 8.9 9.0"
               error="0.1" />
          <lightAsym diode="HE"
               values="0.1 1.2 2.3 3.4 4.5 5.6 6.7 7.8 8.9 9.0"
               error="0.1" />
        </face>
      </xtal>
      <xtal iXtal="8">
        <face end="NA">
          <lightAsym diode="LE"
               values="0.1 1.2 2.3 3.4 4.5 5.6 6.7 7.8 8.9 9.0"
               error="0.1" />
          <lightAsym diode="HE"
               values="0.1 1.2 2.3 3.4 4.5 5.6 6.7 7.8 8.9 9.0"
               error="0.1" />
        </face>
      </xtal>
      <xtal iXtal="9">
        <face end="NA">
          <lightAsym diode="LE"
               values="0.1 1.2 2.3 3.4 4.5 5.6 6.7 7.8 8.9 9.0"
               error="0.1" />
          <lightAsym diode="HE"
               values="0.1 1.2 2.3 3.4 4.5 5.6 6.7 7.8 8.9 9.0"
               error="0.1" />
        </face>
      </xtal>
      <xtal iXtal="10">
        <face end="NA">
          <lightAsym diode="LE"
               values="0.1 1.2 2.3 3.4 4.5 5.6 6.7 7.8 8.9 9.0"
               error="0.1" />
          <lightAsym diode="HE"
               values="0.1 1.2 2.3 3.4 4.5 5.6 6.7 7.8 8.9 9.0"
               error="0.1" />
        </face>
      </xtal>
      <xtal iXtal="11">
        <face end="NA">
          <lightAsym diode="LE"
               values="0.1 1.2 2.3 3.4 4.5 5.6 6.7 7.8 8.9 9.0"
               error="0.1" />
          <lightAsym diode="HE"
               values="0.1 1.2 2.3 3.4 4.5 5.6 6.7 7.8 8.9 9.0"
               error="0.1" />
        </face>
      </xtal>
    </layer>
    <layer iLayer="1">
      <xtal iXtal="0">
	<face end="NA">
          <lightAsym diode="LE"
               values="0.1 1.2 2.3 3.4 4.5 5.6 6.7 7.8 8.9 9.0"
               error="0.1" />
          <lightAsym diode="HE"
               values="0.1 1.2 2.3 3.4 4.5 5.6 6.7 7.8 8.9 9.0"
               error="0.1" />
        </face>
      </xtal>
      <xtal iXtal="1">
        <face end="NA">
          <lightAsym diode="LE"
               values="0.1 1.2 2.3 3.4 4.5 5.6 6.7 7.8 8.9 9.0"
               error="0.1" />
          <lightAsym diode="HE"
               values="0.1 1.2 2.3 3.4 4.5 5.6 6.7 7.8 8.9 9.0"
               error="0.1" />

        </face>
      </xtal>
      <xtal iXtal="2">
        <face end="NA">
          <lightAsym diode="LE"
               values="0.1 1.2 2.3 3.4 4.5 5.6 6.7 7.8 8.9 9.0"
               error="0.1" />
          <lightAsym diode="HE"
               values="0.1 1.2 2.3 3.4 4.5 5.6 6.7 7.8 8.9 9.0"
               error="0.1" />
        </face>
      </xtal>
      <xtal iXtal="3">
        <face end="NA">
          <lightAsym diode="LE"
               values="0.1 1.2 2.3 3.4 4.5 5.6 6.7 7.8 8.9 9.0"
               error="0.1" />
          <lightAsym diode="HE"
               values="0.1 1.2 2.3 3.4 4.5 5.6 6.7 7.8 8.9 9.0"
               error="0.1" />
        </face>
      </xtal>
      <xtal iXtal="4">
        <face end="NA">
          <lightAsym diode="LE"
               values="0.1 1.2 2.3 3.4 4.5 5.6 6.7 7.8 8.9 9.0"
               error="0.1" />
          <lightAsym diode="HE"
               values="0.1 1.2 2.3 3.4 4.5 5.6 6.7 7.8 8.9 9.0"
               error="0.1" />
        </face>
      </xtal>
      <xtal iXtal="5">
        <face end="NA">
          <lightAsym diode="LE"
               values="0.1 1.2 2.3 3.4 4.5 5.6 6.7 7.8 8.9 9.0"
               error="0.1" />
          <lightAsym diode="HE"
               values="0.1 1.2 2.3 3.4 4.5 5.6 6.7 7.8 8.9 9.0"
               error="0.1" />
        </face>
      </xtal>
      <xtal iXtal="6">
        <face end="NA">
          <lightAsym diode="LE"
               values="0.1 1.2 2.3 3.4 4.5 5.6 6.7 7.8 8.9 9.0"
               error="0.1" />
          <lightAsym diode="HE"
               values="0.1 1.2 2.3 3.4 4.5 5.6 6.7 7.8 8.9 9.0"
               error="0.1" />
        </face>
      </xtal>
      <xtal iXtal="7">
        <face end="NA">
          <lightAsym diode="LE"
               values="0.1 1.2 2.3 3.4 4.5 5.6 6.7 7.8 8.9 9.0"
               error="0.1" />
          <lightAsym diode="HE"
               values="0.1 1.2 2.3 3.4 4.5 5.6 6.7 7.8 8.9 9.0"
               error="0.1" />
        </face>
      </xtal>
      <xtal iXtal="8">
        <face end="NA">
          <lightAsym diode="LE"
               values="0.1 1.2 2.3 3.4 4.5 5.6 6.7 7.8 8.9 9.0"
               error="0.1" />
          <lightAsym diode="HE"
               values="0.1 1.2 2.3 3.4 4.5 5.6 6.7 7.8 8.9 9.0"
               error="0.1" />
        </face>
      </xtal>
      <xtal iXtal="9">
        <face end="NA">
          <lightAsym diode="LE"
               values="0.1 1.2 2.3 3.4 4.5 5.6 6.7 7.8 8.9 9.0"
               error="0.1" />
          <lightAsym diode="HE"
               values="0.1 1.2 2.3 3.4 4.5 5.6 6.7 7.8 8.9 9.0"
               error="0.1" />
        </face>
      </xtal>
      <xtal iXtal="10">
        <face end="NA">
          <lightAsym diode="LE"
               values="0.1 1.2 2.3 3.4 4.5 5.6 6.7 7.8 8.9 9.0"
               error="0.1" />
          <lightAsym diode="HE"
               values="0.1 1.2 2.3 3.4 4.5 5.6 6.7 7.8 8.9 9.0"
               error="0.1" />
        </face>
      </xtal>
      <xtal iXtal="11">
        <face end="NA">
          <lightAsym diode="LE"
               values="0.1 1.2 2.3 3.4 4.5 5.6 6.7 7.8 8.9 9.0"
               error="0.1" />
          <lightAsym diode="HE"
               values="0.1 1.2 2.3 3.4 4.5 5.6 6.7 7.8 8.9 9.0"
               error="0.1" />
        </face>
      </xtal>
    </layer>

    <layer iLayer="2">
      <xtal iXtal="0">
	<face end="NA">
          <lightAsym diode="LE"
               values="0.1 1.2 2.3 3.4 4.5 5.6 6.7 7.8 8.9 9.0"
               error="0.1" />
          <lightAsym diode="HE"
               values="0.1 1.2 2.3 3.4 4.5 5.6 6.7 7.8 8.9 9.0"
               error="0.1" />
        </face>
      </xtal>
      <xtal iXtal="1">
        <face end="NA">
          <lightAsym diode="LE"
               values="0.1 1.2 2.3 3.4 4.5 5.6 6.7 7.8 8.9 9.0"
               error="0.1" />
          <lightAsym diode="HE"
               values="0.1 1.2 2.3 3.4 4.5 5.6 6.7 7.8 8.9 9.0"
               error="0.1" />

        </face>
      </xtal>
      <xtal iXtal="2">
        <face end="NA">
          <lightAsym diode="LE"
               values="0.1 1.2 2.3 3.4 4.5 5.6 6.7 7.8 8.9 9.0"
               error="0.1" />
          <lightAsym diode="HE"
               values="0.1 1.2 2.3 3.4 4.5 5.6 6.7 7.8 8.9 9.0"
               error="0.1" />
        </face>
      </xtal>
      <xtal iXtal="3">
        <face end="NA">
          <lightAsym diode="LE"
               values="0.1 1.2 2.3 3.4 4.5 5.6 6.7 7.8 8.9 9.0"
               error="0.1" />
          <lightAsym diode="HE"
               values="0.1 1.2 2.3 3.4 4.5 5.6 6.7 7.8 8.9 9.0"
               error="0.1" />